,HS 1996 Product Code,HS 1996 Product Description,cluster_labels
1,102,Live bovine animals.,5
4,105,"Live poultry, that is to say, fowls of the species Gallus domesticus, ducks, geese, turkeys and guinea fowls.",5
5,106,Other live animals.,5
16,301,Live fish.,5
23,401,"Milk and cream, not concentrated nor containing added sugar or other sweetening matter.",5
25,403,"Buttermilk, curdled milk and cream, yogurt, kephir and other fermented or acidified milk and cream, whether or not concentrated or containing added sugar or other sweetening matter or flavoured or containing added fruit",5
28,406,Cheese and curd.,5
29,407,"Birds' eggs, in shell, fresh, preserved or cooked.",5
31,409,Natural honey.,5
40,508,"Coral and similar materials, unworked or simply prepared but not otherwise worked; shells of molluscs, crustaceans or echinoderms and cuttle-bone, unworked or simply prepared but not cut to shape, powder and waste there",5
43,511,"Animal products not elsewhere specified or included; dead animals of Chapter 1 or 3, unfit for human consumption.",5
45,602,"Other live plants (including their roots), cuttings and slips; mushroom spawn.",5
47,604,"Foliage, branches and other parts of plants, without flowers or flower buds, and grasses, mosses and lichens, being goods of a kind suitable for bouquets or for ornamental purposes, fresh, dried, dyed, bleached, impregn",5
51,704,"Cabbages, cauliflowers, kohlrabi, kale and similar edible brassicas, fresh or chilled.",5
53,706,"Carrots, turnips, salad beetroot, salsify, celeriac, radishes and similar edible roots, fresh or chilled.",5
57,710,"Vegetables (uncooked or cooked by steaming or boiling in water), frozen.",5
58,711,"Vegetables provisionally preserved (for example, by sulphur dioxide gas, in brine, in sulphur water or in other preservative solutions), but unsuitable in that state for immediate consumption.",5
69,808,"Apples, pears and quinces, fresh.",5
72,811,"Fruit and nuts, uncooked or cooked by steaming or boiling in water, frozen, whether or not containing added sugar or other sweetening matter.",5
74,813,"Fruit, dried, other than that of headings Nos. 08.01 to 08.06; mixtures of nuts or dried fruits of this Chapter.",5
93,1008,"Buckwheat, millet and canary seed; other cereals.",5
96,1103,"Cereal groats, meal and pellets.",5
97,1104,"Cereal grains otherwise worked (for example, hulled, rolled, flaked, pearled, sliced or kibbled), except rice of heading No. 10.06; germ of cereals, whole, rolled, flaked or ground.",5
119,1401,"Vegetable materials of a kind used primarily for plaiting (for example, bamboos, rattans, reeds, rushes, osier, raffia, cleaned, bleached or dyed cereal straw, and lime bark).",5
137,1515,"Other fixed vegetable fats and oils (including jojoba oil) and their fractions, whether or not refined, but not chemically modified.",5
139,1517,"Margarine; edible mixtures or preparations of animal or vegetable fats or oils or of fractions of different fats or oils of this Chapter, other than edible fats or oils or their fractions of heading No. 15.16.",5
144,1601,"Sausages and similar products, of meat, meat offal or blood; food preparations based on these products.",5
145,1602,"Other prepared or preserved meat, meat offal or blood.",5
152,1704,"Sugar confectionery (including white chocolate), not containing cocoa.",5
158,1806,Chocolate and other food preparations containing cocoa.,5
162,1904,"Prepared foods obtained by the swelling or roasting of cereals or cereal products (for exam. corn flakes); cereals (other than maize (corn) in grain form or in the form of flakes or other worked grains (except flour and meal), pre-cooke",5
163,1905,"Bread, pastry, cakes, biscuits and other bakers' wares, whether or not containing cocoa; communion wafers, empty cachets of a kind suitable for pharmaceutical use, sealing wafers, rice paper and similar products.",5
164,2001,"Vegetables, fruit, nuts and other edible parts of plants, prepared or preserved by vinegar or acetic acid.",5
168,2005,"Other vegetables prepared or preserved otherwise than by vinegar or acetic acid, not frozen, other than products of heading No. 20.06.",5
170,2007,"Jams, fruit jellies, marmalades, fruit or nut pure and fruit or nut pastes, being cooked preparations, whether or not containing added sugar or other sweetening matter.",5
173,2101,"Extracts, essences and concentrates, of coffee, tea or mat and preparations with a basis of these products or with a basis of coffee, tea or mat; roasted chicory and other roasted coffee substitutes, and extracts, essen",5
174,2102,"Yeasts (active or inactive); other single-cell micro-organisms, dead (but not including vaccines of heading No 30.02); prepared baking powders.",5
175,2103,Sauces and preparations therefor; mixed condiments and mixed seasonings; mustard flour and meal and prepared mustard.,5
176,2104,Soups and broths and preparations therefor; homogenised composite food preparations.,5
177,2105,"Ice cream and other edible ice, whether or not containing cocoa.",5
178,2106,Food preparations not elsewhere specified or included.,5
179,2201,"Waters, including natural or artificial mineral waters and aerated waters, not containing added sugar or other sweetening matter nor flavoured; ice and snow.",5
180,2202,"Waters, including mineral waters and aerated waters, containing added sugar or other sweetening matter or flavoured, and other non-alcoholic beverages, not including fruit or vegetable juices of heading No. 20.09.",5
181,2203,Beer made from malt.,5
184,2206,"Other fermented beverages (for example, cider, perry, mead); mixtures of fermented beverages and mixtures of fermented beverages and non-alcoholic beverages, not elsewhere specified or included.",5
186,2208,"Undenatured ethyl alcohol of an alcoholic strength by volume of less than 80 % vol; spirits, liqueurs and other spirituous beverages.",5
196,2309,Preparations of a kind used in animal feeding.,5
199,2403,Other manufactured tobacco and manufactured tobacco substitutes; homogenised or reconstituted tobacco; tobacco extracts and essences.,5
204,2505,"Natural sands of all kinds, whether or not coloured, other than metalbearing sands of Chapter 26.",5
216,2517,"Pebbles, gravel, broken or crushed stone, of a kind commonly used for concrete aggregates, for road metalling or for railway or other ballast, shingle and flint, whether or not heat-treated; macadam of slag, dross or similar industrial",5
221,2522,"Quicklime, slaked lime and hydraulic lime, other than calcium oxide and hydroxide of heading No. 28.25.",5
266,2716,Electrical energy. (optional heading),5
294,2828,Hypochlorites; commercial calcium hypochlorite; chlorites; hypobromites,5
305,2839,Silicates; commercial alkali metal silicates,5
370,3105,"Mineral or chemical fertilisers containing two or three of the fertilising elements nitrogen, phosphorus and potassium; other fertilisers; goods of this Chapter in tablets or similar forms or in packages of a gross weight not",5
378,3208,"Paints and varnishes (including enamels and lacquers) based on synthetic polymers or chemically modified natural polymers, dispersed or dissolved in a non-aqueous medium; solutions as defined in Note 4 to this Chapter.",5
379,3209,"Paints and varnishes (including enamels and lacquers) based on synthetic polymers or chemically modified natural polymers, dispersed or dissolved in an aqueous medium.",5
384,3214,"Glaziers' putty, grafting putty, resin cements, caulking compounds and other mastics; painters' fillings; non-refractory surfacing preparations for faades, indoor walls, floors, ceilings or the like.",5
386,3301,"Essentials oils (terpeneless or not), including concretes and absolutes; resinoids; extracted oleoresins; concentrates of essential oils in fats, in fixed oils, in waxes or the like, obtained by enfleurage or maceration; terpenic by-pro",5
390,3305,Preparations for use on the hair.,5
392,3307,"Pre-shave, shaving or after-shave preparations, personal deodorants, bath preparations, depilatories and other perfumery, cosmetic or toilet preparations, not elsewhere specified or included ; prepared room deodorisers, whether or not p",5
394,3402,"Organic surface-active agents (other than soap); surface-active preparations, washing preparations (including auxiliary washing preparations) and cleaning preparations, whether or not containing soap, other than those of head",5
433,3814,"Organic composite solvents and thinners, not elsewhere specified or included; prepared paint or varnish removers.",5
458,3915,"Waste, parings and scrap, of plastics.",5
460,3917,"Tubes, pipes and hoses, and fittings therefor (for example, joints, elbows, flanges), of plastics.",5
463,3920,"Other plates, sheets, film, foil and strip, of plastics, non-cellular and not reinforced, laminated, supported or similarly combined with other materials.",5
464,3921,"Other plates, sheets, film, foil and strip, of plastics.",5
465,3922,"Baths, shower-baths, wash-basins, bidets, lavatory pans, seats and covers, flushing cisterns and similar sanitary ware, of plastics.",5
466,3923,"Articles for the conveyance or packing of goods, of plastics; stoppers, lids, caps and other closures, of plastics.",5
467,3924,"Tableware, kitchenware, other household articles and toilet articles, of plastics.",5
468,3925,"Builders' ware of plastics, not elsewhere specified or included.",5
486,4017,"Hard rubber (for example, ebonite) in all forms, including waste and scrap; articles of hard rubber.",5
490,4104,"Leather of bovine or equine animals, without hair on, other than leather of heading No. 41.08 or 41.09.",5
500,4203,"Articles of apparel and clothing accessories, of leather or of composition leather.",5
505,4302,"Tanned or dressed furskins (including heads, tails, paws and other pieces or cuttings), unassembled, or assembled (without the addition of other materials) other than those of heading No. 43.03.",5
508,4401,"Fuel wood, in logs, in billets, in twigs, in faggots or in similar forms; wood in chips or particles; sawdust and wood waste and scrap, whether or not agglomerated in logs, briquettes, pellets or similar forms.",5
510,4403,"Wood in the rough, whether or not stripped of bark or sapwood, or roughly squared.",5
511,4404,"Hoopwood; split poles; piles, pickets and stakes of wood, pointed but not sawn lengthwise; wooden sticks, roughly trimmed but not turned, bent or otherwise worked, suitable for the manufacture of walking-sticks, umbrellas, tool handles",5
514,4407,"Wood sawn or chipped lengthwise, sliced or peeled, whether or not planed, sanded or finger-jointed, of a thickness exceeding 6 mm.",5
515,4408,"Veneer sheets and sheets for plywood (whether or not spliced) and other wood sawn lengthwise, sliced or peeled, whether or not planed, sanded or finger-jointed, of a thickness not exceeding 6 mm.",5
516,4409,"Wood (including strips and friezes for parquet flooring, not assembled) continuously shaped (tongued, grooved, grooved, rebated, chamfered, V-jlinted, beaded, moulded, rounded or the like) along any of its edges or faces, whether or not",5
517,4410,"Particle board and similar board of wood or other ligneous materials, whether or not agglomerated with resins or other organic binding substances.",5
518,4411,"Fibreboard of wood or other ligneous materials, whether or not bonded with resins or other organic substances.",5
519,4412,"Plywood, veneered panels and similar laminated wood.",5
520,4413,"Densified wood, in blocks, plates, strips or profile shapes.",5
522,4415,"Packing cases, boxes, crates, drums and similar packings, of wood; cable-drums of wood; pallets, box pallets and other load boards, of wood; pallet collars of wood.",5
524,4417,"Tools, tool bodies, tool handles, broom or brush bodies and handles, of wood; boot or shoe lasts and trees, of wood.",5
525,4418,"Builders' joinery and carpentry of wood, including cellular wood panels, assembled parquet panels, shingles and shakes.",5
527,4420,"Wood marquetry and inlaid wood; caskets and cases for jewellery or cutlery, and similar articles, of wood; statuettes and other ornaments, of wood; wooden articles of furniture not falling in Chapter 94.",5
528,4421,Other articles of wood.,5
541,4707,Recovered (waste and scrap) paper or paperboard.,5
544,4803,"Toilet or facial tissue stock, towel or napkin stock and similar paper of a kind used for household or saniary purposes, cellulose wadding and webs of cellulose fibres, whether or not creped, crinkled, embossed, perforated, surface-colo",5
549,4808,"Paper and paperboard, corrugated (with or without glued flat surface sheets), creped, crinkled, embossed or perforated, in rolls or sheets, other than paper of the kind described in heading No. 48.03.",5
558,4817,"Envelopes, letter cards, plain postcards and correspondence cards, of paper or paperboard; boxes, pouches, wallets and writing compendiums, of paper or paperboard, containing an assortment of paper stationery.",5
559,4818,"Toilet paper and similar paper, cellulose wadding or webs of cellulose fibres, of a kind used for household or sanitary purposes, in rolls of a width not exceeding 36cm, or cut to size or shape; handkerchiefs, cleansing tissues, towels,",5
560,4819,"Cartons, boxes, cases, bags and other packing containers, of paper, paperboard, cellulose wadding or webs of cellulose fibres; box files, letter trays, and similar articles, of paper or paperboard of a kind used in off",5
561,4820,"Registers, account books, note books, order books, receipt books, letter pads, memorandum pads, diaries and similar articles, exercise books, blotting-pads, blinders (loose-leaf or other), folders, file covers, manifold businee forms, i",5
562,4821,"Paper or paperboard lables of all kinds, whether or not printed.",5
563,4822,"Bobbins, spools, cops and similar supports of paper pulp, paper or paperboard (whether or not perforated or hardened).",5
571,4907,"Unused postage, revenue or similar stamps of current or new issue in the country to which they are destined; stamp-impressed paper; banknotes; cheque forms; stock, share or bond certificates and similar documents of ti",5
599,5204,"Cotton sewing thread, whether or not put up for retail sale.",5
602,5207,Cotton yarn (other than sewing thread) put up for retail sale.,5
620,5402,"Synthetic filament yarn (other than sewing thread), not put up for retail sale, including synthetic monofilament of less than 67 decitex.",5
631,5505,"Waste (including noils, yarn waste and garnetted stock) of man-made fibres.",5
635,5509,"Yarn (other than sewing thread) of synthetic staple fibres, not put up for retail sale.",5
636,5510,"Yarn (other than sewing thread) of artificial staple fibres, not put up for retail sale.",5
640,5514,"Woven fabrics of synthetic staple fibres, containing less than 85 % by weight of such fibres, mixed mainly or solely with cotton, of a weight exceeding 170 g/m2.",5
649,5607,"Twine, cordage, ropes and cables, whether or not plaited or braided and whether or not impregnated, coated, covered or sheathed with rubber or plastics.",5
650,5608,"Knotted netting of twine, cordage or rope; made up fishing nets and other made up nets, of textile materials.",5
651,5609,"Articles of yarn, strip or the like of heading No. 54.04 or 54.05, twine, cordage, rope or cables, not elsewhere specified or included.",5
681,6101,"Men's or boys' overcoats, car-coats, capes, cloaks, anoraks (including ski-jackets), wind-cheaters, wind-jackets and similar articles, knitted or crocheted, other than those of heading No. 61.03.",5
682,6102,"Women's or girls' overcoats, car-coats, capes, cloaks, anoraks (including ski-jackets), wind-cheaters, wind- jackets and similar articles, knitted or crocheted, other than those of heading No. 61.04.",5
683,6103,"Men's or boys' suits, ensembles, jackets, blazers, trousers, bib and brace overalls, breeches and shorts (other than swimwear), knitted or crocheted.",5
684,6104,"Women's or girls' suits, ensembles, jackets, blazers, dresses, skirts, divided skirts, trousers, bib and brace overalls, breeches and shorts (other than swimwear), knitted or crocheted.",5
685,6105,"Men's or boys' shirts, knitted or crocheted.",5
686,6106,"Women's or girls' blouses, shirts and shirt-blouses, knitted or crocheted.",5
687,6107,"Men's or boys' underpants, briefs, nightshirts, pyjamas, bathrobes, dressing gowns and similar articles, knitted or crocheted.",5
688,6108,"Women's or girls' slips, petticoats, briefs, panties, nightdresses, pyjamas, n,glig,s, bathrobes, dressing gowns and similar articles, knitted or crocheted.",5
689,6109,"T-shirts, singlets and other vests, knitted or crocheted.",5
690,6110,"Jerseys, pullovers, cardigans, waist-coats and similar articles, knitted or crocheted.",5
691,6111,"Babies' garments and clothing accessories, knitted or crocheted.",5
692,6112,"Track suits, ski suits and swimwear, knitted or crocheted.",5
693,6113,"Garments, made up of knitted or crocheted fabrics of heading No. 59.03, 59.06 or 59.07.",5
694,6114,"Other garments, knitted or crocheted.",5
695,6115,"Panty hose, tights, stockings, socks and other hosiery, including stockings for varicose veins and footwear without applied soles, knitted or crocheted.",5
698,6201,"Men's or boys' overcoats, car-coats, capes, cloaks, anoraks (including ski-jackets), wind-cheaters, wind-jackets and similar articles, other than those of heading No. 62.03.",5
700,6203,"Men's or boys' suits, ensembles, jackets, blazers, trousers, bib and brace overalls, breeches and shorts (other than swimwear).",5
701,6204,"Women's or girls' suits, ensembles, jackets, blazers, dresses, skirts, divided skirts, trousers, bib and brace overalls, breeches and shorts (other than swimwear).",5
702,6205,Men's or boys' shirts.,5
703,6206,"Women's or girls' blouses, shirts and shirt-blouses.",5
704,6207,"Men's or boys' singlets and other vests, underpants, briefs, nightshirts, pyjamas, bathrobes, dressing gowns and similar articles.",5
705,6208,"Women's or girls' singlets and other vests, slips,  petticoats, briefs, panties, nightdresses, pyjamas, n,glig,s, bathrobes, dressing gowns and similar articles.",5
706,6209,Babies' garments and clothing accessories.,5
707,6210,"Garments, made up of fabrics of heading No. 56.02, 56.03, 59.03, 59.06 or 59.07.",5
708,6211,"Track suits, ski suits and swimwear; other garments.",5
709,6212,"BrassiSres, girdles, corsets, braces, suspenders, garters and similar articles and parts thereof, whether or not knitted or crocheted.",5
717,6303,Curtains (including drapes) and interior blinds; curtain or bed valances.,5
720,6306,"Tarpaulins, awnings and sunblinds; tents; sails for boats, sailboards or landcraft; camping goods.",5
723,6309,Worn clothing and other worn articles.,5
724,6310,"Used or new rags, scrap twine, cordage, rope and cables and worn out articles of twine, cordage, rope or cables, of textile materials.",5
725,6401,"Waterproof footwear with outer soles and uppers of rubber or of plastics, the uppers of which are neither fixed to the sole nor assembled by stitching, riveting, nailing, screwing, plugging or similar processes.",5
727,6403,"Footwear with outer soles of rubber, plastics, leather or composition leather and uppers of leather.",5
729,6405,Other footwear.,5
730,6406,"Parts of footwear (including uppers whether or not attached to soles other than outer soles); removable in-soles, heel cushions and similar articles; gaiters, leggings and similar articles, and parts thereof.",5
753,6809,Articles of plaster or of compositions based on plaster.,5
754,6810,"Articles of cement, of concrete or of artificial stone, whether or not reinforced.",5
769,6910,"Ceramic sinks, wash basins, wash basin pedestals, baths, bidets, water closet pans, flushing cisterns, urinals and similar sanitary fixtures.",5
774,7001,Cullet and other waste and scrap of glass; glass in the mass.,5
783,7010,"Carboys, bottles, flasks, jars, pots, phials, ampoules and other containers, of glass, of a kind used for the conveyance or packing of goods; preserving jars of glass; stoppers, lids and other closures, of glass.",5
815,7204,Ferrous waste and scrap; remelting scrap ingots of iron or steel.,5
821,7210,"Flat-rolled products of iron or non-alloy steel, of a width of 600 mm or more, clad, plated or coated.",5
823,7212,"Flat-rolled products of iron or non-alloy steel, of a width of less than 600 mm, clad, plated or coated.",5
826,7215,Other bars and rods of iron or non-alloy steel.,5
827,7216,"Angles, shapes and sections of iron or non-alloy steel.",5
828,7217,Wire of iron or non-alloy steel.,5
846,7306,"Other tubes, pipes and hollow profiles (for example, open seam or welded, riveted or similarly closed), of iron or steel.",5
848,7308,"Structures (excluding prefabricated buildings of heading No.94.06) and parts of structures (for example, bridges and bridge-sections, lock-gates, towers, lattice masts, roof roofing frame-works, doors and windows and their frames and th",5
849,7309,"Reservoirs, tanks, vats and similar containers for any material (other than compressed or liquefied gas), of iron or steel, of a capacity exceeding 300 l, whether or not lined or heat-insulated, but not fitted with me",5
850,7310,"Tanks, casks, drums, cans, boxes and similar containers, for any material (other than compressed or liquefied gas), of iron or steel, of a capacity not exceeding 300l, whether or not lined or heat-insulated, but not fitted with mechanic",5
851,7311,"Containers for compressed or liquefied gas, of iron or steel.",5
854,7314,"Cloth (including endless bands), grill, netting and fencing, of iron or steel wire; expanded metal of iron or steel.",5
857,7317,"Nails, tacks, drawing pins, corrugated nails, staples (other than those of heading No. 83.05) and similar articles, of iron or steel, whether or not with heads of other material, but excluding such articles with heads",5
865,7325,Other cast articles of iron or steel.,5
870,7404,Copper waste and scrap.,5
895,7602,Aluminium waste and scrap.,5
897,7604,"Aluminium bars, rods and profiles.",5
903,7610,"Aluminium structures (excluding prefabricated buildings of heading No.94.06) and parts of structures (for example, bridges and bridge-sections, towers, lattice masts, roofs, roofing frameworks, doors and windows and their frames and thr",5
905,7612,"Aluminium casks, drums, cans, boxes and similar containers (including rigid or collapsible tubular containers), for any material (other than compressed or liquefied gas), of a capacity not exceeding 300 l, whether or not lined or heat-i",5
911,7802,Lead waste and scrap.,5
915,7806,Other articles of lead.,5
917,7902,Zinc waste and scrap.,5
966,8309,"Stoppers, caps and lids (including crown corks, screw caps and pouring stoppers), capsules for bottles, threaded bungs, bung covers, seals and other packing accessories, of base metal.",5
1018,8450,"Household or laundry-type washing machines, including machines which both wash and dry.",5
1081,8528,"Reception apparatus for television, whether or not incorporating radio-broadcast receivers or sound or video recording or reproducing apparatus; video monitors and video projectors.",5
1097,8544,"Insulated (including enamelled or anodised) wire, cable (including co-axial cable)mand other insulated electric conductors, whether or not fitted with connectors; optical fibre cables, made up of individually sheathed fibres, whether or",5
1126,8716,"Trailers and semi-trailers; other vehicles, not mechanically propelled; parts thereof.",5
1203,9401,"Seats (other than those of heading No. 94.02), whether or not convertible into beds, and parts thereof.",5
1205,9403,Other furniture and parts thereof.,5
1206,9404,"Mattress supports; articles of bedding and similar furnishing (for example, mattresses, quilts, eiderdowns,",5
1208,9406,Prefabricated buildings.,5
1215,9507,"Fishing rods, fish-hooks and other line fishing tackle; fish landing nets, butterfly nets and similar nets; decoy birds (other than those of heading No. 92.08 or 97.05) and similar hunting or shooting requisites.",5
